{
  "manifest_version": "phase6.11",
  "manifest_type": "operational_gate_approval_decision",
  "status": "operational_gate_approval_decision_recorded",
  "created_for_phase": "6.11",
  "inherits_from_phase": ["6.0", "6.1", "6.2", "6.3", "6.4", "6.5", "6.6", "6.7", "6.8", "6.9", "6.10"],
  "created_at": "2026-06-04T05:00:00.000Z",
  "scope": {
    "allowed": [
      "read_existing_phase6_0_plan",
      "read_existing_phase6_1_manifest",
      "read_existing_phase6_2_manifest",
      "read_existing_phase6_3_manifest",
      "read_existing_phase6_4_manifest",
      "read_existing_phase6_5_manifest",
      "read_existing_phase6_6_manifest",
      "read_existing_phase6_7_manifest",
      "read_existing_phase6_8_manifest",
      "read_existing_phase6_9_manifest",
      "read_existing_phase6_10_manifest",
      "record_operational_gate_approval_decision",
      "document_gate_decisions",
      "document_item_constraints",
      "document_rollback_boundary",
      "document_audit_boundary"
    ],
    "forbidden": [
      "execute_batch",
      "set_crawler_allowed_true",
      "set_renderer_allowed_true",
      "set_recovery_allowed_true",
      "set_web_requests_allowed_true",
      "set_ai_learning_generation_allowed_true",
      "run_crawler",
      "run_renderer",
      "run_recovery",
      "make_web_requests",
      "modify_source_layer",
      "generate_ai_learning_content",
      "capture_assets",
      "create_raw_snapshots",
      "create_intermediate_json"
    ]
  },
  "approval_status": "operational_mode_approved",
  "approved_decision": "approve_operational_execution_mode",
  "approved_execution_mode": "offline_existing_source_packet_only",
  "batch_id": "phase6_1_batch_001",
  "execution_authorization_status": "execution_approved",
  "plan_status": "planned_not_executed",
  "decision_metadata": {
    "decision_id": "operational_gate_decision_phase6_11_001",
    "decision_type": "human_operational_gate_approval",
    "decision_phase": "6.11",
    "decision_timestamp": "2026-06-04T05:00:00.000Z",
    "requesting_phase": "6.10",
    "approved_request": "approve_operational_execution_mode",
    "approval_scope": "operational_execution_mode_only"
  },
  "phase_gates": {
    "phase6_1_entry_allowed": true,
    "activation_allowed": true,
    "batch_executable": true,
    "execution_allowed": true,
    "crawler_allowed": false,
    "renderer_allowed": false,
    "recovery_allowed": false,
    "web_requests_allowed": false,
    "ai_learning_generation_allowed": false
  },
  "operational_gate_decisions": {
    "crawler_gate_decision": "not_required",
    "renderer_gate_decision": "not_required",
    "recovery_gate_decision": "not_required",
    "web_requests_gate_decision": "not_required",
    "ai_learning_generation_gate_decision": "not_allowed",
    "constraint": "All operational gates remain false. No gate is opened by this decision."
  },
  "input_boundary": {
    "allowed_items": ["1.3"],
    "approved_items": ["1.3"],
    "deferred_items": ["9.1"],
    "quarantined_items": ["13.3"],
    "item_count": 1,
    "source_layer_mutation_allowed": false,
    "constraints": [
      "Only item 1.3 may be processed",
      "9.1 remains deferred",
      "13.3 remains quarantined and ineligible",
      "No new item may be added",
      "No quarantined item may be selected",
      "No source layer mutation may occur in this phase"
    ]
  },
  "allowed_future_artifacts": {
    "description": "These artifacts are planned only, not created in Phase 6.11",
    "artifacts": [
      {
        "name": "controlled_batch_run_record",
        "purpose": "Records batch execution metadata",
        "created_when": "During future execution",
        "status": "planned"
      },
      {
        "name": "execution_audit_log",
        "purpose": "Records step-by-step execution trace",
        "created_when": "During future execution",
        "status": "planned"
      },
      {
        "name": "item_level_execution_result",
        "purpose": "Records per-item outcome (1.3)",
        "created_when": "During future execution",
        "status": "planned"
      },
      {
        "name": "post_run_validation_report",
        "purpose": "Validates execution invariants",
        "created_when": "After future execution",
        "status": "planned"
      }
    ]
  },
  "forbidden_phase6_11_artifacts": {
    "description": "Phase 6.11 must NOT create any of these artifacts",
    "artifacts": [
      "raw_snapshots",
      "intermediate_json",
      "rendered_outputs",
      "crawler_outputs",
      "recovery_outputs",
      "ai_learning_content",
      "source_layer_mutations",
      "newly_captured_assets",
      "web_request_results"
    ]
  },
  "no_go_confirmation": {
    "no_batch_execution_occurs": true,
    "no_crawler_runs": true,
    "no_renderer_runs": true,
    "no_recovery_runs": true,
    "no_web_requests_made": true,
    "no_source_layer_modified": true,
    "no_ai_learning_generated": true,
    "no_assets_captured": true,
    "no_raw_snapshots_created": true,
    "no_intermediate_json_created": true,
    "crawler_allowed_remains_false": true,
    "renderer_allowed_remains_false": true,
    "recovery_allowed_remains_false": true,
    "web_requests_allowed_remains_false": true,
    "ai_learning_generation_allowed_remains_false": true
  },
  "operational_assertions": {
    "expansion_execution_claimed": false,
    "crawler_output_claimed": false,
    "renderer_output_claimed": false,
    "recovery_output_claimed": false,
    "ai_learning_generation_claimed": false,
    "source_layer_mutation_declared": false,
    "web_requests_declared": false,
    "raw_snapshots_created": false,
    "intermediate_json_created": false,
    "assets_captured": false
  },
  "rollback_boundary": {
    "phase6_11_rollback_needed": false,
    "reason": "No rollback needed for Phase 6.11 because no artifacts are created and no execution occurs",
    "future_execution_requirements": [
      "Future execution must define rollback before running",
      "Future execution must isolate item 1.3 outputs from global source layer",
      "Rollback target: return batch to execution_approved status",
      "Rollback scope: remove generated output artifacts for item 1.3",
      "Source preservation: source layer artifacts must remain untouched"
    ]
  },
  "audit_boundary": {
    "prior_phase_chain": ["6.0", "6.1", "6.2", "6.3", "6.4", "6.5", "6.6", "6.7", "6.8", "6.9", "6.10"],
    "current_approval_status": "operational_mode_approved",
    "current_execution_authorization_status": "execution_approved",
    "current_plan_status": "planned_not_executed",
    "current_operational_gates": {
      "phase6_1_entry_allowed": true,
      "activation_allowed": true,
      "batch_executable": true,
      "execution_allowed": true,
      "crawler_allowed": false,
      "renderer_allowed": false,
      "recovery_allowed": false,
      "web_requests_allowed": false,
      "ai_learning_generation_allowed": false
    },
    "no_go_confirmation": true,
    "validation_commands": [
      "pnpm typecheck",
      "pnpm verify",
      "pnpm validate:operational-gate-approval-decision"
    ],
    "commit_scope": "Only Phase 6.11 operational gate approval decision files and related schema/type/validator/package script changes"
  },
  "phase_progression_history": [
    { "phase": "6.0", "outcome": "controlled_source_expansion_plan_created" },
    { "phase": "6.1", "outcome": "batch_selection_manifest_created" },
    { "phase": "6.2", "outcome": "gate_recheck_completed" },
    { "phase": "6.3", "outcome": "activation_readiness_preflight_passed" },
    { "phase": "6.4", "outcome": "batch_activation_human_approval_request_created" },
    { "phase": "6.5", "outcome": "batch_activation_human_approval_decision_accepted" },
    { "phase": "6.6", "outcome": "batch_execution_readiness_preflight_passed" },
    { "phase": "6.7", "outcome": "batch_execution_human_approval_request_created" },
    { "phase": "6.8", "outcome": "batch_execution_human_approval_decision_accepted" },
    { "phase": "6.9", "outcome": "controlled_batch_execution_plan_created" },
    { "phase": "6.10", "outcome": "operational_gate_approval_request_created" },
    { "phase": "6.11", "outcome": "operational_gate_approval_decision_recorded" }
  ],
  "validation_expectations": {
    "schema_validation": "must_pass",
    "invariant_checks": "must_pass",
    "approval_status_must_be": "operational_mode_approved",
    "approved_decision_must_be": "approve_operational_execution_mode",
    "approved_execution_mode_must_be": "offline_existing_source_packet_only",
    "operational_assertions_all_false": true,
    "no_go_confirmations_all_true": true,
    "item_constraints_satisfied": true,
    "future_artifacts_planned_only": true,
    "forbidden_artifacts_explicitly_listed": true,
    "operational_gate_decisions_all_not_required_or_not_allowed": true
  }
}
